Y,text
1,man wondering might sort website featuring footage sexual acts one may view purposes self gratification
1,bed bug feels bad area man bug got eat
1,report inner tube occupants agree get better
1,car parked windshield wipers halfway offers glimpse world suspended time
1,raytheon ceo sends obama another article mounting unrest libya
1,congress repairs parlor hear rep carolyn maloney play recorder
1,powerball super fans camping big drawing dressed favorite numbers
1,news jenna elfman sitcom sends herd buffalo wild stampede
1,hillary clinton clearly tailoring debate answers unclaimed new york superdelegate
1,bus transporting carnival cruise passengers crashes sewage treatment plant
1,staff members new defense secretary wondering still get summers
1,john boehner beheads juarez cartel member dared muscle legal weed turf
1,new gop plan offers tax breaks contributions tucked congressmen suit breast pocket
1,changing channel local bar process area man anticipated
1,sweeping new labor reforms allow foxconn employees work inhumane conditions home
1,like hearing listening says man representative oscar mayer customer service hotline
1,tearful trump admits nato alliance closest thing friendship ever
1,dog believe owner left fucking msnbc keep company work
1,game thrones fans shocked little goblin something killed last night episode
1,exhilarated woman discovers last person used jigsaw puzzle left lots pieces sticking together
1,twas hubris led thinks naked woman sitting public toilet romper around ankles
1,aspiring felon moved man get first convictions
1,class reunion attendees trick sue thorpe thinking jeff urban likes
1,zika virus joins lack paid leave unaffordable child care reasons woman afraid getting pregnant
1,study finds placing one foot forward remains best method walking
1,mueller annoyed chipper overeager adam schiff constantly sending evidence already uncovered
1,scientists warn plant life dying within yard radius ted cruz campaign signs
1,mitch mcconnell hands vocal cords removed prevent self holding hearing scalia replacement
1,report selected make purchase onion store
1,teen unsure break parents devil got pregnant
1,manafort shares tense silence rick gates car ride back trial
1,onion guarantees watch new amazon series shall spared
1,white house holding continuous going away party departing staffers
1,barber latest string humans feign interest area man says
1,researchers announce heart reveal happen women
1,trump relaxes debate slipping back nice warm personal reality
1,green party official caught embezzling campaign funds dime bag
1,chicago police credit extensive experience falsifying evidence helping solve smollett case
1,backup plan case menu item stock well thought part man life
1,teen coming shell giving bully lots new material work
1,family friends concerned peyton manning wanders away pocket
1,family kind concerned fast dad ate father day gift
1,equal man says stern woman likely menstruate
1,report authorities recommend film got mail snowed today
1,true detective fan develops elaborate theory let season finale
1,biden gets grow light delivered white house fake name
1,uber driver wants know lots mexicans live neighborhood
1,loan officer future warns stop mortgaging home prime rate
1,meghan markle nervously looking clinic pamphlets weighing options
1,tylenol releases new black bile gel caps people unbalanced humors
0,white house official reportedly said mass shooting reprieve chaos
0,lot americans thumbs roger goodell tom brady
0,facts know trade affect
0,dolores huerta calls trump treating latinos like newcomers
0,new hbo documentary shows really like inside terror attack
0,gone wind actress says turning best role
0,questions could determine whether marriage last fail
0,obamas invited state union address
0,ryan gosling first choice people sexiest man alive
0,dad asks famous people tweet bullied son happy birthday deliver
0,martin shkreli wants one kanye new album
0,donald trump lawyer claims president never told son russia meeting
0,twitter users roast fbi paint style holiday tweet
0,black teens affected gun violence speak ahead march lives
0,soft corruption clinton inc could cost democrats presidency
0,gop lawmaker matt gaetz slams haiti sheet metal garbage everywhere look
0,sign petition archbishop reportedly invited kim davis meet pope
0,samantha bee rounds comedians ultimate roast donald trump
0,deputy head norway labor party resigns amid sexual harassment allegations
0,spring sprung arctic way early
0,uncertain duterte trump powerful china vietnam sees stability asean
0,lemon sean spicer everyone dumber listened
0,people animals baby hummingbirds incubators means spring come
0,mike pence anti abortion crowd trump supreme court pick mold antonin scalia
0,steve bannon suggests donald trump met russians
0,get republicans change minds minimum wage
0,watch obama get little nostalgic final state union
0,netanyahu meets donald trump hillary clinton ahead first debate
0,professor threatened firing says wheaton college changing rules
0,amy krouse rosenthal daughter continues late mother last project
0,nba nerds catch joke nba trailer
0,rescue animals get help need thanks online donations
0,happens ask arya stark write yearbook quote
0,mitch mcconnell says elections excuse senators skip work
0,simpsons predicted disney would buy fox nearly years ago
0,video kourtney kardashian eating kit kat bar celeb culture run amok
0,astronauts hugged response reporter question political tension
0,roger ailes hires lawyer possible lawsuit new york magazine
0,black men sentences percent longer white men similar crimes
0,pit bull lost hope kids found grass
0,nice luke let kesha perform billboard music awards
0,pregnancy related deaths nearly doubled texas cuts women health
0,mack wilds plays crooked cop new fox drama shots fired
0,woody allen says harvey weinstein scandal sad everyone involved
0,portraits sikh men reveal diverse beauty turbans beards
0,getting closer leaving home without phones thing key
0,actor nils hognestad performs front live audience assembly required
0,first amendment lawsuit says student punished wearing shirt advocating gun rights
0,ryan reynolds wished brother happy birthday way knows
0,hopper stranger things wore holiday sweater became meme
